{
  "$schema": "https://json-schema.org/draft/2020-12/schema",
  "$id": "https://worldspec.dev/schemas/0.1/h1-locomotion-task-load-profile.schema.json",
  "title": "WorldSpec H1 Task-Load Calibration Profile 0.1",
  "type": "object",
  "required": [
    "id",
    "profileVersion",
    "status",
    "stage",
    "baseTrainingProfileDigest",
    "a5ckEvidence",
    "runtime",
    "warmStart",
    "trainingOverrides",
    "environment",
    "qualityGates",
    "artifactPolicy",
    "evidenceStatus"
  ],
  "properties": {
    "id": {
      "$ref": "common.schema.json#/$defs/id"
    },
    "profileVersion": {
      "const": "0.1.0"
    },
    "status": {
      "const": "research"
    },
    "stage": {
      "const": "loaded_track_settle_task_load"
    },
    "baseTrainingProfileDigest": {
      "const": "sha256:6c2002f7fedaae1739416c96e7698b389d8ddc7bedc7386921e141964128eec6"
    },
    "a5ckEvidence": {
      "const": {
        "job": "worldspec-h1-midterm-5nn2q",
        "controlProfileDigest": "sha256:23fcf6908136c57880871ac0a1f9e1f13339b5d8f562eb0af8d710362f75efa8",
        "reportDigest": "sha256:a9d4458eb2ed16186c73e41dbdb16e1753e35ee32e30b0407eae981931f0256b",
        "controllerDigest": "sha256:0f1ffed386123d21cb45eb5708c2ed849cd22f7244e7a9ceb05a6df1bae8f0db",
        "traceDigest": "sha256:175427d1d3d74da7fe5c422f3290f07ae6dfa6c21179626dd4d4558915012bd9",
        "traceRecordCount": 386,
        "terminalReason": "fall_height",
        "maximumForwardCommand": 0.5,
        "maximumBackwardVelocity": -2.459172010421753,
        "formalControlGate": "failed"
      }
    },
    "runtime": {
      "type": "object",
      "required": [
        "containerImage",
        "containerDigest",
        "packageLockDigest",
        "ccdIterations"
      ],
      "properties": {
        "containerImage": {
          "type": "string",
          "pattern": "^\\S+@sha256:[0-9a-f]{64}$"
        },
        "containerDigest": {
          "$ref": "common.schema.json#/$defs/digest"
        },
        "packageLockDigest": {
          "const": "sha256:7cc88f20b2c608d6fe673f3b994b879db69d75361206bf25f949d7acc5ed3a41"
        },
        "ccdIterations": {
          "const": 50
        }
      },
      "additionalProperties": false
    },
    "warmStart": {
      "const": {
        "sourceStage": "loaded-track-settle-transition-v2-failed",
        "sourceReportDigest": "sha256:1d7310274a58e78e21570fe0916c23af49573f41d769037393967d41ce89705d",
        "checkpointDigest": "sha256:2e4590c9291c81581205aee02c4bf168b9532790a14aecac839faee68954d356",
        "checkpointSizeBytes": 8838595,
        "distribution": "internal_only",
        "restore": {
          "normalizer": true,
          "policy": true,
          "value": true
        },
        "optimizerState": "reset"
      }
    },
    "trainingOverrides": {
      "const": {
        "numTimesteps": 16777216,
        "numEnvs": 4096,
        "numEvals": 8,
        "episodeLength": 1000,
        "unrollLength": 20,
        "numMinibatches": 16,
        "numUpdatesPerBatch": 4,
        "batchSize": 256
      }
    },
    "environment": {
      "const": {
        "commandDistribution": {
          "linearVelocityX": [
            0.0,
            0.6
          ],
          "linearVelocityY": [
            -0.1,
            0.1
          ],
          "angularVelocityYaw": [
            -0.25,
            0.25
          ],
          "zeroCommandProbability": 0.2
        },
        "transitionCurriculum": {
          "mode": "move_then_zero",
          "transitionCycleProbability": 0.75,
          "moveSteps": 150,
          "settleSteps": 50,
          "motionCommandDistribution": {
            "linearVelocityX": [
              0.4,
              0.6
            ],
            "linearVelocityY": [
              -0.05,
              0.05
            ],
            "angularVelocityYaw": [
              -0.1,
              0.1
            ]
          }
        },
        "taskLoadCurriculum": {
          "mode": "static_right_arm_pose_and_base_disturbance",
          "sourceJob": "worldspec-h1-midterm-5nn2q",
          "sourceTraceDigest": "sha256:175427d1d3d74da7fe5c422f3290f07ae6dfa6c21179626dd4d4558915012bd9",
          "heldTargetScale": [
            0.5,
            1.0
          ],
          "initialBaseVelocityX": [
            -0.1,
            0.1
          ],
          "heldTargets": [
            0.0,
            0.0,
            0.0,
            0.0,
            0.0,
            0.1543052911758423,
            0.09892238825658843,
            -0.006488978405079102,
            -0.19852599334400028
          ],
          "heldFeedforward": [
            0.032988220529269176,
            -1.1402555002525037,
            0.08486267857762098,
            0.012800121336152957,
            -1.0451398037469817,
            -0.9578816827225751,
            0.837737275364864,
            0.46023224988862355,
            -4.402542577541209
          ],
          "observationAugmentation": "none",
          "qualityGatesChanged": false
        },
        "termination": {
          "minimumBaseHeight": 0.5,
          "minimumUprightCosine": 0.25,
          "jointLimitToleranceRadians": 0.02
        },
        "reward": {
          "survival": 3.0,
          "trackingLinear": 6.0,
          "trackingYaw": 2.0,
          "upright": 3.0,
          "baseHeight": 2.0,
          "pose": 0.5,
          "verticalVelocityCost": 1.0,
          "angularVelocityXYCost": 0.5,
          "torqueCost": 0.000002,
          "actionRateCost": 0.03,
          "settleLinear": 8.0,
          "settleYaw": 3.0,
          "settleActionRateScale": 0.25
        },
        "targets": {
          "baseHeight": 0.98
        },
        "sigmas": {
          "tracking": 0.2,
          "upright": 0.05,
          "baseHeight": 0.02,
          "pose": 0.2,
          "settleTracking": 0.05
        },
        "commandResampleSteps": 200
      }
    },
    "qualityGates": {
      "const": {
        "minimumFinalMeanEpisodeLength": 900.0,
        "nominalDurationSeconds": 4.0,
        "moveDurationSeconds": 3.0,
        "settleWindowSeconds": 1.0,
        "requiredConsecutivePasses": 5,
        "minimumForwardDisplacement": 1.0,
        "maximumForwardDisplacement": 2.2,
        "maximumLateralDrift": 0.2,
        "maximumTrackingRmse": 0.25,
        "minimumBaseHeight": 0.8,
        "minimumUprightCosine": 0.8,
        "maximumSettleLinearSpeed": 0.2,
        "maximumSettleAngularSpeed": 0.4,
        "maximumStandPlanarDrift": 0.2,
        "maximumNonFiniteSamples": 0
      }
    },
    "artifactPolicy": {
      "const": {
        "checkpoint": "research_only",
        "distribution": "internal_only"
      }
    },
    "evidenceStatus": {
      "const": "derived"
    }
  },
  "additionalProperties": false
}
